NOME DA CAMPANHA;DESCRIÇÃO;DATA INI;DATA FIM;VLD /CASHBACK;INVESTIMENTO;MAX/CPF;BLOQUEIO;REFERENCIA
1-CAMPANHA PARÁ BS DISTRIBUIDORA-01;Oferta válida para compras realizadas por pessoas físicas com limite de R$ 2,00 por CPF, nas lojas Mateus Supermercados, Mix Atacarejo, do estado do Pará . Vigente de 21/06/2021 a 27/06/2021 ou enquanto durarem os estoques.;21/06/2021;27/06/2021;5;R$ 10.674,00;R$ 2,00;1;GLEICY
EAN(S);NOME DO PRODUTO ;GATILHO;CASHBACK;;;;;
7896020162681;TALCO TENYS PE BARUEL JS SEM PERF 92G; 1 ; R$ 1,00 ;;;;;
7896020162650;TALCO TENYS PE BARUEL AER SEM PERF 110G; 1 ; R$ 1,00 ;;;;;
7896020162674;TALCO TENYS PE BARUEL PO SEM PERF 100G; 1 ; R$ 1,00 ;;;;;
7896020162476;SAB LIQ BARUEL T XUXINHA GLICERINA 400ML; 1 ; R$ 1,00 ;;;;;
7896020162520;SAB LIQ BARUEL T XUXINHA S/CORANTE 400ML; 1 ; R$ 1,00 ;;;;;
7896020162537;SAB LIQ BARUEL T XUXINHA SONO TRAN 400ML; 1 ; R$ 1,00 ;;;;;
