NOME DA CAMPANHA;DESCRIÇÃO;DATA INI;DATA FIM;VLD /CASHBACK;INVESTIMENTO;MAX/CPF;BLOQUEIO;REFERENCIA
1-CAMPANHA PARÁ GP ALIMENTOS-01;Oferta válida para compras realizadas por pessoas físicas com limite de R$ 4,00 por CPF, nas lojas Mateus Supermercados, Mix Atacarejo, do estado do Pará . Vigente de 21/06/2021 a 24/06/2021 ou enquanto durarem os estoques.;21/06/2021;24/06/2021;5;R$ 3.000,00;R$ 4,00;1;3 - JOSELIA FERREIRA
EAN(S);NOME DO PRODUTO ;GATILHO;CASHBACK;;;;;
7898959253126;LING PERNIL C/ALHO CONG BRAGANCA 500G;1; R$ 1,00 ;;;;;
7898959253133;LING PERNIL C/AZEIT CONG BRAGANCA 500G;1; R$ 1,00 ;;;;;
7898959253157;LING PERNIL C/BACON CONG BRAGANCA 500G;1; R$ 1,00 ;;;;;
7898959253119;LING PERNIL C/PIM CONG BRAGANCA 500G;1; R$ 1,00 ;;;;;
7898959253140;LING PERNIL C/PROVOLONE BRAGANCA 500G;1; R$ 1,00 ;;;;;
